{
  "$schema": "../schemas/prompt.schema.json",
  "id": "fix-save-push-credential-lock",
  "title": "Fix Git Push Credential Lock and Non-Fast-Forward on Save",
  "description": "Resolve credential storage lock permission denied and non-fast-forward rejection during save by adding pull-rebase, lock cleanup, concurrency serialization, and clear error surfacing",
  "authors": [
    {
      "name": "User",
      "type": "human"
    },
    {
      "name": "Claude",
      "type": "model"
    }
  ],
  "createdAt": "2026-02-20T12:00:00Z",
  "status": "ready",
  "tags": [
    "bugfix",
    "git",
    "save-flow",
    "credential-lock"
  ],
  "content": "## Fix Git Push Credential Lock and Non-Fast-Forward on Save\n\nWhen a user hits save, git push fails with:\n\n```\nfatal: unable to get credential storage lock in 1000 ms: Permission denied\n! [rejected] main -> main (non-fast-forward)\n```\n\nImplement a production-safe solution addressing all four root causes.\n\n### 1. Pull --rebase Before Push (No Force Push)\n\nIn `server.js`, update the `/api/git/push` endpoint so that after `git commit`, it runs `git pull --rebase origin main` before `git push origin main`.\n\n- Never use `git push --force` or `--force-with-lease`.\n- If the rebase encounters conflicts, run `git rebase --abort` to restore the working tree, then return an error explaining that remote changes conflict with local edits.\n- If `git commit` reports \"nothing to commit\", return success with a message like \"No changes to push\" rather than treating it as an error.\n\n### 2. Fix Credential Helper Locking Issue\n\nThe `~/.git-credential-store.lock` file can become stale when a previous git operation was interrupted or timed out.\n\n- Before any git operation that contacts the remote, check for `~/.git-credential-store.lock`.\n- If the lock file exists and is older than 30 seconds, remove it — an active credential helper would not hold the lock that long.\n- If the lock file is fresh (< 30s old), wait briefly and retry rather than immediately failing.\n- Ignore `ENOENT` when checking — no lock file means the happy path.\n\n### 3. Concurrency-Safe Save Flow\n\nConcurrent save requests can cause interleaved git operations, leading to lock contention and corrupted state.\n\n- Add an async serialization queue (e.g., a promise chain or `p-queue` with concurrency 1) so that only one git add/commit/pull/push sequence runs at a time.\n- The queue must swallow rejections from completed operations so that subsequent queued operations still execute.\n- Wrap the entire push endpoint handler body inside the serialization queue.\n\n### 4. Clear Surfaced User Errors\n\nClassify git failures and return structured JSON error responses with user-friendly messages:\n\n- **Credential lock** (`/credential.*lock/i`): \"Git credential storage is temporarily locked. Please try again in a few seconds.\"\n- **Non-fast-forward** (`/non-fast-forward/i`): \"Remote has newer changes. Pull and retry.\"\n- **Rebase conflict**: \"Remote has conflicting changes. Your local commit is preserved but could not be pushed.\"\n- **Network error** (`/could not read from remote/i`): \"Cannot connect to GitHub. Check network and try again.\"\n- **Auth failure** (`/authentication failed/i`): \"GitHub authentication failed. Credentials may need to be refreshed.\"\n- **Unknown**: Include the raw error message.\n\nReturn `{ success: false, error: <userMessage>, errorCode: <code>, stdout, stderr }` with HTTP 500.\n\nOn the frontend (`SaveDialog.tsx`), display the classified error message. For transient errors (credential lock, network), append a note that the user can retry and show a \"Retry Push\" button.\n\n### Acceptance Criteria\n- [ ] `git pull --rebase origin main` runs after commit and before push\n- [ ] No `git push --force` anywhere in the codebase\n- [ ] Stale `.git-credential-store.lock` files (>30s old) are cleaned before remote operations\n- [ ] All git operations in the push endpoint are serialized through a single-concurrency queue\n- [ ] \"Nothing to commit\" returns success, not an error\n- [ ] Error responses include `errorCode` and a user-friendly `error` message\n- [ ] Frontend shows classified errors with retry option for transient failures",
  "executions": []
}
